{"receiptId":"approval","provenance":"human-confirmed","actorLabel":"Leo","decision":"grant","grantedAt":"2099-01-01T00:00:00.000Z","expiresAt":"2099-01-02T00:00:00.000Z","changeId":"change","taskId":"task","scope":"task","operationKind":"external-write","decisionFingerprint":"aaaaaaaaaaaaaaaaaaaaaaaaaaaaaaaaaaaaaaaaaaaaaaaaaaaaaaaaaaaaaaaa","gateDefinitionFingerprint":"bbbbbbbbbbbbbbbbbbbbbbbbbbbbbbbbbbbbbbbbbbbbbbbbbbbbbbbbbbbbbbbb","argvFingerprint":"cccccccccccccccccccccccccccccccccccccccccccccccccccccccccccccccc","cwdFingerprint":"dddddddddddddddddddddddddddddddddddddddddddddddddddddddddddddddd","environmentFingerprint":"eeeeeeeeeeeeeeeeeeeeeeeeeeeeeeeeeeeeeeeeeeeeeeeeeeeeeeeeeeeeeeee","inputFingerprint":"ffffffffffffffffffffffffffffffffffffffffffffffffffffffffffffffff"}
